{
  "$schema": "https://json-schema.org/draft/2020-12/schema",
  "$id": "https://github.com/darndestdabbler/uat-checklist-editor/checklist-schema.json",
  "title": "UAT Checklist",
  "description": "Schema for UAT checklist files used by the UAT CheckList Editor",
  "type": "object",
  "required": ["ProjectName", "Review"],
  "properties": {
    "ProjectName": {
      "type": "string",
      "description": "Name of the project or solution under test"
    },
    "ReleaseLabel": {
      "type": "string",
      "description": "Release version, sprint, or build identifier (e.g., 'v2.1.0-rc1', 'Sprint 14')"
    },
    "DocumentDate": {
      "type": "string",
      "description": "Last-saved timestamp, auto-populated by the editor on save"
    },
    "Configuration": {
      "type": "object",
      "description": "Editor UI state (column widths, etc.). Managed by the editor — do not hand-edit",
      "properties": {
        "reviewWidths": {
          "type": "array",
          "items": { "type": "string" },
          "description": "Saved column widths for the review table"
        }
      },
      "additionalProperties": true
    },
    "Review": {
      "type": "array",
      "description": "The checklist items, grouped by FunctionalArea and Subarea",
      "items": {
        "type": "object",
        "required": ["FunctionalArea", "Subarea", "ItemLabel"],
        "properties": {
          "Id": {
            "type": "string",
            "format": "uuid",
            "description": "Stable GUID for the checklist item. Generated once at item creation and never edited. Used by the uat-coverage-review task to mechanically pair this item to its E2E test method (the method's header comment declares 'UAT Item Id: <guid>'). Editor displays this field above the Navigation panel."
          },
          "FunctionalArea": {
            "type": "string",
            "description": "Top-level grouping (e.g., 'Authentication', 'Issue Management'). Rendered as a section header in the editor"
          },
          "Subarea": {
            "type": "string",
            "description": "Second-level grouping within a functional area (e.g., 'Login', 'Create Issue'). Rendered as a subsection header"
          },
          "ItemLabel": {
            "type": "string",
            "description": "Short name for this checklist item (e.g., 'Standard Login', 'Validation')"
          },
          "HumanAction": {
            "type": "string",
            "description": "Step-by-step action the tester should perform. Used when Steps is absent; superseded by Steps when present"
          },
          "Expectation": {
            "type": "string",
            "description": "Expected result after performing the action. Used when Steps is absent"
          },
          "Steps": {
            "type": "array",
            "description": "Optional structured steps. When present, supersedes HumanAction/Expectation for display. Each step has an action and a list of verifications. Backward compatibility: when absent, the editor falls back to HumanAction/Expectation",
            "items": {
              "type": "object",
              "required": ["StepNumber", "Action"],
              "properties": {
                "StepNumber": {
                  "type": "integer",
                  "description": "Sequential step number (1, 2, 3, ...)"
                },
                "Action": {
                  "type": "string",
                  "description": "What the tester does. Supports {{VariableName}} placeholders resolved against TestData"
                },
                "Verifications": {
                  "type": "array",
                  "description": "Checks the tester performs after the action. Rendered as an indented bullet list under the step",
                  "items": {
                    "type": "object",
                    "required": ["Text"],
                    "properties": {
                      "Text": {
                        "type": "string",
                        "description": "Human-readable verification description"
                      },
                      "VerificationMethod": {
                        "type": "string",
                        "enum": ["ui", "api", "sql"],
                        "default": "ui",
                        "description": "How the verification is performed. Defaults to 'ui' when absent. Non-ui methods render with a small badge"
                      },
                      "Query": {
                        "type": "string",
                        "description": "SQL query for 'sql' verifications. Displayed inline so the tester can run it"
                      },
                      "ExpectedValue": {
                        "description": "Expected value the verification should yield. Type varies by verification"
                      }
                    },
                    "additionalProperties": false
                  }
                }
              },
              "additionalProperties": false
            }
          },
          "TestData": {
            "type": "object",
            "description": "Optional map of {{VariableName}} substitutions applied to each step's Action text. Lets the same checklist run against different environments without editing step text",
            "additionalProperties": true
          },
          "E2ETestReference": {
            "type": "string",
            "description": "Optional identifier of the automated E2E test that mirrors these steps (e.g., 'ClassName.MethodName'). Makes coverage auditable and is consumed by the uat-coverage-review task"
          },
          "IsJudgmentItem": {
            "type": "boolean",
            "default": false,
            "description": "When true, marks a cosmetic/UX item that cannot be automated and is exempt from the E2E coverage requirement. Editor renders a 'Human Judgment' badge. The uat-coverage-review task skips these items"
          },
          "Passes": {
            "type": "boolean",
            "default": false,
            "description": "Whether this item passed testing. Always false for 'Other' items"
          },
          "Feedback": {
            "type": "string",
            "default": "",
            "description": "Tester's observations, notes, or bug description"
          },
          "IsOtherItem": {
            "type": "boolean",
            "default": false,
            "description": "When true, this is an open-ended feedback row. The editor auto-generates one per subarea if not present. HumanAction and Expectation are ignored"
          }
        },
        "additionalProperties": false
      }
    }
  },
  "additionalProperties": false
}
